{
    "id": "ETH",
    "name": "ETH",
    "symbol": "ETH",
    "description": "Ether",
    "vaultSymbol": "yETH",
    "erc20address": "Ethereum",
    "vaultContractAddress": "0xe1237aA7f535b0CC33Fd973D66cBf830354D16c7",
    "vaultContractABI": "config.vaultContractV4ABI",
    "balance": 0,
    "vaultBalance": 0,
    "decimals": 18,
    "deposit": true,
    "depositAll": false,
    "withdraw": true,
    "withdrawAll": true,
    "lastMeasurement": 10774489,
    "measurement": 1000000000000000000
}
